{
  "template_type": "export",
  "slug": "blank",
  "name": "Blank Export",
  "description": "Create from scratch. Empty export for custom configuration.",
  "version": "1.0.0",
  "tags": ["blank", "starter"],
  "use_cases": ["Start from scratch", "Custom export"],
  "entity": {
    "export_id": "{{EXPORT_ID}}",
    "organization_id": "{{ORGANIZATION_ID}}",
    "project_id": "{{PROJECT_ID}}",
    "name": "{{NAME}}",
    "export_type": "webhook",
    "operation_config": {
      "endpoint_url": "{{ENDPOINT_URL}}",
      "method": "POST",
      "auth_type": "{{AUTH_TYPE}}",
      "batch_mode": false
    },
    "created_at": "{{CREATED_AT}}",
    "updated_at": "{{UPDATED_AT}}"
  },
  "placeholders": {
    "{{EXPORT_ID}}": "Generated UUID for the export",
    "{{ORGANIZATION_ID}}": "Organization that owns this export",
    "{{PROJECT_ID}}": "Project containing this export",
    "{{NAME}}": "User-provided name for the export",
    "{{ENDPOINT_URL}}": "Webhook or endpoint URL",
    "{{AUTH_TYPE}}": "Authentication type: none, bearer, api_key",
    "{{CREATED_AT}}": "ISO 8601 timestamp",
    "{{UPDATED_AT}}": "ISO 8601 timestamp"
  }
}
